{"artifact":{"bytes":36961,"path":"public/artifacts/text-gc-document-edit/text-gc-document-edit.wasm","sha256":"4a3083a510acc7f26fc4bd1877c87321545931b0b05580db2d5efdbc3d3582b5"},"fixtureManifest":{"path":"public/artifacts/text-gc-document-edit/fixture-manifest.json","sha256":"8b4145b0d91f6eb086e7c3cabe1bf1bb9a647c9e7771ad0f824005141ebe5681"},"frozenCatalog":{"immutable":"byte-for-byte","path":"catalog/workloads.v1.json","sha256":"6665664f984683e5b7d3fdc8c1602198124844704c224a526d48be2f02edf9d4"},"outputs":[{"bytes":3042,"path":"public/artifacts/text-gc-document-edit/text-gc-document-edit.mjs","sha256":"a4994be989542f4cc826fc2b782974b83ca81b55614eee22553cc064fc4bcb23"},{"bytes":4147,"path":"public/artifacts/text-gc-document-edit/text-gc-document-edit.import-object.mjs","sha256":"10be918973da81e5a576212ecae8c17a6b423e13015aeb92f899c7d781b5e111"},{"bytes":1328,"path":"public/artifacts/text-gc-document-edit/text-gc-document-edit.js-builtins.mjs","sha256":"5265daba0f4204a469f87b09f6a63ebfc59555441e4fcc98f8b2006115048451"},{"bytes":36961,"path":"public/artifacts/text-gc-document-edit/text-gc-document-edit.wasm","sha256":"4a3083a510acc7f26fc4bd1877c87321545931b0b05580db2d5efdbc3d3582b5"}],"reference":{"path":"public/artifacts/text-gc-document-edit/reference.json","sha256":"4b38bffbe6c4f9787a4d629ccbd363ebc52318195f5141dde55011333582b695"},"registrationId":"text.gc-document-edit.v1-supplemental-registration-v1","schemaVersion":1,"sourceCommit":"82caa7620a93e27fe7cabb080529a3465a5a972a","sourceRepository":"https://github.com/PaulKinlan/wasm-vs-js","sourceTreeSha256":"85ef7d1c5e82588ada76ccffb11b02f34d4e32efa8e9a19dfc276621f2ccc106","sources":[{"bytes":196,"gitBlobOid":"115e6ed9168b9f0297b633653feb563bd8c60e47","path":"benchmarks/v1/text-gc-document-edit/kotlin/settings.gradle.kts","sha256":"49cea7a546a266ebc29c0a5989f05ba4837db71818b741102a52ac592c8fd434"},{"bytes":293,"gitBlobOid":"7d1395a93b22936b19dfbeba638e80ecb5792c04","path":"benchmarks/v1/text-gc-document-edit/kotlin/build.gradle.kts","sha256":"5e5738466f64bf214e74b603dbbc34f6297d1fd97bcf1f5a49e67cab3f644608"},{"bytes":162,"gitBlobOid":"55d58827abc8b76605939e70b60afe51d534c273","path":"benchmarks/v1/text-gc-document-edit/kotlin/gradle.properties","sha256":"e860ac81b67a233f4d6bacbbdd2f309a47b14bce529b2cbb1e77a62ebf12b0e4"},{"bytes":1930,"gitBlobOid":"356956c71f4b28b8a6a5e09e322e84ad321ac37e","path":"benchmarks/v1/text-gc-document-edit/kotlin/gradle.lockfile","sha256":"41a1f4453446716261897c494eed43991d19095ccb491c543cbc538debd8719f"},{"bytes":23630,"gitBlobOid":"b90632a43c6f680fd43ba8584a6df0aec9e7ed3f","path":"benchmarks/v1/text-gc-document-edit/kotlin/gradle/verification-metadata.xml","sha256":"a46a108afa2e20e2973aa459f7f1dc6087027695b359ed5425b6b6fcbe741354"},{"bytes":908,"gitBlobOid":"df901137c97f177314df4215773d245204ff327c","path":"benchmarks/v1/text-gc-document-edit/kotlin/toolchain.lock.json","sha256":"40da9417bb5e2329f33fbb891a1464831eaa766aced08dde9f09dc26318c278b"},{"bytes":9618,"gitBlobOid":"198081a4159f929bcdfe6b97df3930b494ee2a12","path":"benchmarks/v1/text-gc-document-edit/kotlin/src/wasmJsMain/kotlin/Main.kt","sha256":"39a38106cae1594bc30bcb4ace9cbdea23a993dce8b4597208d12f46b039a496"},{"bytes":8358,"gitBlobOid":"b14867120d1f0fbbb6e29bc6aed37bc15f525074","path":"benchmarks/v1/text-gc-document-edit/workload.js","sha256":"466731002f3c005583c26592f4495cb80cc42639e40b1f0c6de236f7676eb443"},{"bytes":5823,"gitBlobOid":"2e02d13f43707f807bb3c2aecc9bc13c506ea345","path":"scripts/build-text-gc-document-edit-fixture.ts","sha256":"a05f300a8d0847866cc69ed5dae36ace5e0afbd9af899d36de4b7b90a2130887"},{"bytes":3119,"gitBlobOid":"7b7a573641e1e03d59c4083770dd78d61a8d4108","path":"scripts/build-text-gc-document-edit-wasmgc.sh","sha256":"a904b72457837f72dd8f88e55c56b31001e91eeeee4f10f0e5985c13448a8b0b"},{"bytes":6772,"gitBlobOid":"b2f84c401fbcd3fd978c6efee0fb755e3d8b51e9","path":"scripts/finalize-text-gc-document-edit-wasmgc.ts","sha256":"8424c6edfa1e5bf69bb0412864bf651d5d36df219666fe469961de255be96359"},{"bytes":2523,"gitBlobOid":"e9a29fb5a6a20a6b443cac2603dfceb6593f7eb1","path":"deno.json","sha256":"1fb796ab0a517cac5b34d6b0225dc1316f7dae952460c45fec46acbe9d71ec5b"},{"bytes":6048,"gitBlobOid":"94c1050aaf343d9d6e16cb243da4d4e32ac1f07f","path":"deno.lock","sha256":"6096fd28d3d67a7f257969678d76a37f244c7114d309db6a5acc1ec461bd7948"}],"target":"wasmgc-controlled","toolchain":{"command":"scripts/build-text-gc-document-edit-wasmgc.sh","deno":"2.9.0","dependencyVerification":{"mode":"strict","path":"benchmarks/v1/text-gc-document-edit/kotlin/gradle/verification-metadata.xml","sha256":"a46a108afa2e20e2973aa459f7f1dc6087027695b359ed5425b6b6fcbe741354"},"generatedGluePatch":"replace Deno-only unversioned std/path import with node:url fileURLToPath; replace browser fetch with exact pre-hashed Wasm bytes supplied by the worker","gradle":"9.6.1","gradleDistributionSha256":"9c0f7faeeb306cb14e4279a3e084ca6b596894089a0638e68a07c945a32c9e14","java":{"executableSha256":"0868c4200b2f78fc9e767841cc63200350303519eec74b9458031ee234e5bcb9","home":"/usr/lib/jvm/java-26-openjdk","releaseFileSha256":"4b67a4f6526d3a2d82edca270da64ac3f560fb6a1340bfbc9ad72ae08666cd44","runtimeVersion":"26.0.1","vendor":"Arch Linux","version":"26.0.1"},"kotlinPlugin":"2.3.21","target":"wasmJs browser production executable"},"wasmFeatures":{"exceptionHandling":true,"gc":true,"jsStringBuiltins":true,"portableGcDiagnostics":"unavailable","proof":"Kotlin/Wasm compiler target plus successful module execution and wasmGcFeatureProof export; validation test rejects missing GC struct/array type forms"}}
